{"schema_version":"1.0","epoch":"E0","phase":"pending","plan_ref":{"path":"plan/versions/plan-1.0.0.json","sha256":"0000000000000000000000000000000000000000000000000000000000000000"},"input_refs":{"spec":{"path":"spec/spec.json","sha256":"0000000000000000000000000000000000000000000000000000000000000000"},"target_profile":{"path":"inputs/target.json","sha256":"0000000000000000000000000000000000000000000000000000000000000000"},"test_bundle":{"path":"inputs/test_bundle.json","sha256":"0000000000000000000000000000000000000000000000000000000000000000"}},"blueprint":{},"constraints":{},"blueprint_sha256":"0000000000000000000000000000000000000000000000000000000000000000","rendering_view":{},"rendering_view_sha256":"0000000000000000000000000000000000000000000000000000000000000000","expected_files":[{"path":"include/api.h","sha256":"e3b0c44298fc1c149afbf4c8996fb92427ae41e4649b934ca495991b7852b855","content":""}],"build_results":[],"smoke_results":[],"checkpoint_commit":null,"checkpoint_tree":null,"output_refs":{}}
